{
  "schemaVersion": "1",
  "slug": "site",
  "name": "Astrodock Site",
  "description": "The astrodock.ai marketing site. Static HTML, no framework — served at the apex once pointed there in Settings.",
  "subdomain": "site",
  "source": {
    "branch": "main",
    "repoPath": "site"
  },
  "runtime": {
    "type": "node",
    "buildCommand": "npm run build"
  },
  "auth": { "mode": "public" },
  "database": { "mode": "none" },
  "storage": { "mode": "none" },
  "env": []
}
