{
  "schemaVersion": "1",
  "slug": "docs",
  "name": "Astrodock Docs",
  "description": "The Astrodock documentation site — static HTML, no framework, no build step beyond a copy.",
  "subdomain": "docs",
  "source": {
    "branch": "main",
    "repoPath": "docs"
  },
  "runtime": {
    "type": "node",
    "buildCommand": "npm run build"
  },
  "auth": { "mode": "public" },
  "database": { "mode": "none" },
  "storage": { "mode": "none" },
  "env": []
}
